<?xml version = "1.0" encoding = "UTF-8" standalone = "yes" ?>
<country xmlns:xsi="http://www.w3.org/2001/XMLSchema-instance" xsi:noNamespaceSchemaLocation="country.xsd"
    name="United Kingdom">
     <economics-data>
		 <GDP value="3,070,670"/>
		 <PPP value="3,656,809"/>
		 <population value="67.508,936"/>
		 <GDP-growth value="4.1"/>
	</economics-data>
	
		
    <!-- Taken from 
  	  	https://en.wikipedia.org/wiki/List_of_countries_by_median_age
    	https://www.worlddata.info/average-bodyheight.php -->
    <characteristics median-age-male="39.6" median-age-female="41.7" 
    			average-male-height="177" average-female-height="163"
	            average-male-weight="90.6" average-female-weight="77.1"/>

    <first-name-list>
		<!-- https://momlovesbest.com/british-boy-names -->
		
        <first-name value="Aidan" gender="male" />
        <first-name value="Aldis" gender="male" />
        <first-name value="Alfred" gender="male" />
        <first-name value="Alistair" gender="male" />
        <first-name value="Archibald" gender="male" />
        
		<!-- https://www.netmums.com/pregnancy/top-1000-baby-boy-names-uk -->

        <first-name value="Leo" gender="male" />
        <first-name value="Henry" gender="male" />
        <first-name value="Theodore" gender="male" />
        <first-name value="Freddie" gender="male" />
        <first-name value="Finley" gender="male" />
        
        <first-name value="Arlo" gender="male" />
        <first-name value="Lucas" gender="male" />
        <first-name value="Roman" gender="male" />
        <first-name value="Tommy" gender="male" />
        <first-name value="Isaac" gender="male" />
        
		<!-- Miscs. -->
        <first-name value="Oliver" gender="male" />
        <first-name value="Jacob" gender="male" />
        <first-name value="Charlie" gender="male" />
        <first-name value="Jack" gender="male" />
        <first-name value="Noah" gender="male" />
        
        <first-name value="Alfie" gender="male" />
        <first-name value="Oscar" gender="male" />
        <first-name value="William" gender="male" />
        <first-name value="George" gender="male" />
        <first-name value="Harry" gender="male" />

	<!-- https://www.bounty.com/pregnancy-and-birth/baby-names/top-baby-names/the-latest-top-100-boys-names-chosen-in-the-uk-this-year -->

        <first-name value="Noah" gender="male" />
        <first-name value="Theo" gender="male" />
        <first-name value="Luca" gender="male" />
        <first-name value="Arthur" gender="male" />
        <first-name value="Archie" gender="male" />
        
        <first-name value="George" gender="male" />
        <first-name value="Albie" gender="male" /> 
        <first-name value="Finley" gender="male" />
        <first-name value="Jude" gender="male" />
        <first-name value="Charlie" gender="male" />
        
        <first-name value="Elijah" gender="male" />
        <first-name value="Tommy" gender="male" />
        <first-name value="Oakley" gender="male" />
        <first-name value="Hudson" gender="male" />
        <first-name value="Rory" gender="male" />

        <first-name value="Reuben" gender="male" />
        <first-name value="Louie" gender="male" />
        <first-name value="Reggie" gender="male" />
        <first-name value="Theodore" gender="male" />
        <first-name value="Ezra" gender="male" />
        
		<!-- https://www.netmums.com/pregnancy/top-1000-baby-girl-names-uk -->
        <first-name value="Amelia" gender="female" />
        <first-name value="Olivia" gender="female" />
        <first-name value="Emily" gender="female" />
        <first-name value="Isla" gender="female" />
        <first-name value="Ava" gender="female" />
     
        <first-name value="Ivy" gender="female" />
        <first-name value="Lily" gender="female" />
        <first-name value="Florence" gender="female" />
        <first-name value="Mia" gender="female" />
        <first-name value="Willow" gender="female" />
     
        <first-name value="Rosie" gender="female" />
        <first-name value="Sophia" gender="female" />
        <first-name value="Grace" gender="female" />
        <first-name value="Daisy" gender="female" />
        <first-name value="Sienna" gender="female" />

        <first-name value="Poppy" gender="female" />
        <first-name value="Elsie" gender="female" />
        <first-name value="Ella" gender="female" />
        <first-name value="Evelyn" gender="female" />
        <first-name value="Phoebe" gender="female" />
   
        <first-name value="Jessica" gender="female" />
        <first-name value="Ella" gender="female" />
        <first-name value="Isabella" gender="female" />
        <first-name value="Poppy" gender="female" />
        <first-name value="Mia" gender="female" />
  
  		<!-- https://www.bounty.com/pregnancy-and-birth/baby-names/top-baby-names/the-latest-top-100-girls-names-chosen-in-the-uk-this-year -->
       
        <first-name value="Harper" gender="female" />
        <first-name value="Bonnie" gender="female" />
        <first-name value="Freya" gender="female" />
        <first-name value="Evie" gender="female" />    
        <first-name value="Charlotte" gender="female" />
        
        <first-name value="Willow" gender="female" />
        <first-name value="Sienna" gender="female" />
        <first-name value="Florence" gender="female" />
        <first-name value="Delilah" gender="female" />  
        <first-name value="Maisie" gender="female" />

        <first-name value="Lottie" gender="female" />
        <first-name value="Aria" gender="female" />
        <first-name value="Millie" gender="female" />
        <first-name value="Maya" gender="female" />
        <first-name value="Violet" gender="female" />
   
        <first-name value="Arabella" gender="female" />
        <first-name value="Aurora" gender="female" />
        <first-name value="Matilda" gender="female" />
        <first-name value="Sofia" gender="female" />
        <first-name value="Hallie" gender="female" />
        
        <first-name value="Maeve" gender="female" />
        <first-name value="Mabel" gender="female" />
        <first-name value="Esme" gender="female" />
        <first-name value="Ruby" gender="female" />
        <first-name value="Emily" gender="female" />
        
    </first-name-list>
    
    <last-name-list>
        <!-- 10 common UK surnames, taking into account individual countries -->

        <last-name value="Brown" />
        <last-name value="Campbell" />
        <last-name value="Davies" />
        <last-name value="Evans" />
        <last-name value="Jones" />
        
        <last-name value="Robertson" />
        <last-name value="Smith" />
        <last-name value="Taylor" />
        <last-name value="Thomson" />
        <last-name value="Wilson" />
        
        <!-- https://en.wiktionary.org/wiki/Appendix:English_surnames_(England_and_Wales) -->
        
        <last-name value="Williams" />
        <last-name value="Johnson" />
        <last-name value="Roberts" />
        <last-name value="Thompson" />
        <last-name value="Wright" />
        
        <last-name value="Walker" />
        <last-name value="White" />
        <last-name value="Edwards" />
        <last-name value="Hughes" />
        <last-name value="Green" />
        
        <last-name value="Hall" />
        <last-name value="Lewis" />
        <last-name value="Harris" />
        <last-name value="Clarke" />
        <last-name value="Patel" />
             
		<last-name value="Jackson" />
        <last-name value="Wood" />
        <last-name value="Turner" />
        <last-name value="Martin" />
        <last-name value="Cooper" />
        
        <last-name value="Hill" />
        <last-name value="Morris" />
        <last-name value="Ward" />
        <last-name value="Moore" />
        <last-name value="Clark" />
        
        <last-name value="Baker" />
        <last-name value="Harrison" />
        <last-name value="King" />
        <last-name value="Morgan" />
        <last-name value="Lee" />
             
        <last-name value="Allen" />
        <last-name value="James" />
        <last-name value="Phillips" />
        <last-name value="Scott" />
        <last-name value="Watson" />
        
        <!-- https://one-name.org/modern-british-surnames/statistics/top-surnames/england-wales/top-500-names/  From 46 to 80 -->
              
        <last-name value="Parker" />
        <last-name value="Price" />
        <last-name value="Bennett" />
        <last-name value="Young" />
        <last-name value="Griffiths" />
        
        <last-name value="Mitchell" />
        <last-name value="Kelly" />
        <last-name value="Cook" />
        <last-name value="Carter" />
        <last-name value="Richardson" />
        
        <last-name value="Bailey" />
        <last-name value="Collins" />
        <last-name value="Bell" />
        <last-name value="Shaw" />
        <last-name value="Murphy" />
             
		<last-name value="Miller" />
        <last-name value="Cox" />
        <last-name value="Richards" />
        <last-name value="Khan" />
        <last-name value="Marshall" />
        
        <last-name value="Anderson" />
        <last-name value="Simpson" />
        <last-name value="Ellis" />
        <last-name value="Adams" />
        <last-name value="Singh" />
        
        <last-name value="Begum" />
        <last-name value="Wilkinson" />
        <last-name value="Foster" />
        <last-name value="Chapman" />
        <last-name value="Powell" />
             
        <last-name value="Webb" />
        <last-name value="Rogers" />
        <last-name value="Gray" />
        <last-name value="Mason" />
        <last-name value="Ali" />             
             
    </last-name-list>
</country>