<?xml version = "1.0" encoding = "UTF-8" standalone = "yes" ?>
<country xmlns:xsi="http://www.w3.org/2001/XMLSchema-instance" xsi:noNamespaceSchemaLocation="country.xsd"
    name="Ireland">
    <first-name-list>
        <first-name value="Jack" gender="male" />
        <first-name value="James" gender="male" />
        <first-name value="Daniel" gender="male" />
        <first-name value="Conor" gender="male" />
        <first-name value="SeÃ¡n" gender="male" />
        <first-name value="Adam" gender="male" />
        <first-name value="Noah" gender="male" />
        <first-name value="Michael" gender="male" />
        <first-name value="Charlie" gender="male" />
        <first-name value="Luke" gender="male" />

        <first-name value="Emily" gender="female" />
        <first-name value="Emma" gender="female" />
        <first-name value="Ava" gender="female" />
        <first-name value="Sophie" gender="female" />
        <first-name value="Amelia" gender="female" />
        <first-name value="Ella" gender="female" />
        <first-name value="Lucy" gender="female" />
        <first-name value="Grace" gender="female" />
        <first-name value="Chloe" gender="female" />
        <first-name value="Mia" gender="female" />
    </first-name-list>
    <last-name-list>
        <!-- 10 most common Irish surnames -->

        <last-name value="Byrne" />
        <last-name value="Kelly" />
        <last-name value="Murphy" />
        <last-name value="Ryan" />
        <last-name value="Smith" />
        <last-name value="Sullivan" />
        <last-name value="O'Brien" />
        <last-name value="O'Connor" />
        <last-name value="O'Neill" />
        <last-name value="Walsh" />
    </last-name-list>
</country>       