<?xml version = "1.0" encoding = "UTF-8" standalone = "yes" ?>
<country xmlns:xsi="http://www.w3.org/2001/XMLSchema-instance" xsi:noNamespaceSchemaLocation="country.xsd"
        name="Italy">
     <economics-data>
		 <GDP value="2,010,430"/>
		 <PPP value="3,052,609"/>
		 <population value="59.037474"/>
		 <GDP-growth value="3.67"/>
	</economics-data>
	
	<!-- Taken from 
  	  	https://en.wikipedia.org/wiki/List_of_countries_by_median_age
    	https://www.worlddata.info/average-bodyheight.php -->
    <characteristics median-age-male="45.4" median-age-female="47.5" 	
    			average-male-height="174" average-female-height="161"
	            average-male-weight="80.9" average-female-weight="64.8"/>	
	             
    <first-name-list>
        <first-name value="Francesco" gender="male" />
        <first-name value="Alessandro" gender="male" />
        <first-name value="Mattia" gender="male" />
        <first-name value="Lorenzo" gender="male" />
        <first-name value="Leonardo" gender="male" />
        <first-name value="Andrea" gender="male" />
        <first-name value="Gabriele" gender="male" />
        <first-name value="Matteo" gender="male" />
        <first-name value="Tommaso" gender="male" />
        <first-name value="Riccardo" gender="male" />

        <first-name value="Giuseppe" gender="male" />
        <first-name value="Giovanni" gender="male" />
        <first-name value="Antonio" gender="male" />
        <first-name value="Luigi" gender="male" />
        <first-name value="Mario" gender="male" />
        <first-name value="Salvatore" gender="male" />
        <first-name value="Vincenzo" gender="male" />
        <first-name value="Roberto" gender="male" />
        <first-name value="Paolo" gender="male" />
        <first-name value="Marco" gender="male" />
        
        <first-name value="Angelo" gender="male" />
        <first-name value="Domenico" gender="male" />
        <first-name value="Pietro" gender="male" />
        <first-name value="Michele" gender="male" />
        <first-name value="Franco" gender="male" />
        <first-name value="Carlo" gender="male" />
        <first-name value="Stefano" gender="male" />
        
        
        <first-name value="Sofia" gender="female" />
        <first-name value="Aurora" gender="female" />
        <first-name value="Giulia" gender="female" />
        <first-name value="Giorgia" gender="female" />
        <first-name value="Alice" gender="female" />
        <first-name value="Martina" gender="female" />
        <first-name value="Emma" gender="female" />
        <first-name value="Greta" gender="female" />
        <first-name value="Chiara" gender="female" />
        <first-name value="Anna" gender="female" />
        
        <first-name value="Maria" gender="female" />
        <first-name value="Giuseppina" gender="female" />
        <first-name value="Rosa" gender="female" />
        <first-name value="Angela" gender="female" />
        <first-name value="Giovanna" gender="female" />
        <first-name value="Teresa" gender="female" />
        <first-name value="Lucia" gender="female" />
        <first-name value="Carmela" gender="female" />
        <first-name value="Caterina" gender="female" />
        <first-name value="Francesca" gender="female" />
        
        <first-name value="Antonietta" gender="female" />
        <first-name value="Carla" gender="female" />
        <first-name value="Elena" gender="female" />
        <first-name value="Concetta" gender="female" />
        <first-name value="Rita" gender="female" />
        <first-name value="Margherita" gender="female" />
        <first-name value="Franca" gender="female" />
        <first-name value="Paola" gender="female" />

        
        
    </first-name-list>
    <last-name-list>
        <!-- 10 most common Italian surnames -->

        <last-name value="Bianchi" />
        <last-name value="Colombo" />
        <last-name value="Esposito" />
        <last-name value="Ferrari" />
        <last-name value="Greco" />
        <last-name value="Marino" />
        <last-name value="Ricci" />
        <last-name value="Romano" />
        <last-name value="Rossi" />
        <last-name value="Russo" />
    </last-name-list>
</country>